Emotion,Text
anger," But that ’ s not the only thing ... you know , he really doesn ’ t have the best work ethic , I ’ m constantly catching him on MSN and Facebook when he should be talking to clients . "
sadness,I dreamt of my father's death while I was at secondary school.  I was screaming at the top of my voice and was woken up by my friend.  That day I was really sad.
neutral, How ? 
fear,David is concerned at the length of time he says it took for an ambulance to arrive . 
anger,Last night - finding that someone in the house had eaten an entire packet of almonds I had bought for a family treat.
joy,I 'm thrilled to see her ! 
fear,When my dog ran out on thin ice last spring.
sadness," Oh , that ’ s very sad . "
fear,"` When we came to tell you that the service was postponed you were in a very agitated state -- but then it was difficult to persuade you to leave off playing . "" "
sadness,"I remember the day my father died. I was 11 years old and my sadness was so great that until today I remember everything about that day, from the clothes I was wearing to the reactions of people, the despair of my mother and brother. It marked me a lot and was the greatest sadness I felt."
sadness,When my boyfriend almost had a relationship with a close friend of mine.
anger,"A certain person started to say dreadful things very calmly, I felt hurt and disgusted."
fear,Whenever I think of enrolling in Organic Chemistry.
sadness,My father dying.
sadness,To buy a car and didn't like the business and the car.
sadness, We'll get to go fishing at the river . I hate fish . 
neutral, Why ? 
joy, They obviously thought I was doing terribly badly at that time and were very pleased at how well they had rigged me out  until I put on the mac . 
anger,Somebody took my wristwatch and promised to have it mended and later was telling me that he couldn't give it back to me because I was rude at a certain time.
sadness,When I realized that it did not make much sense to start a relationship with a girl who was not very constructive to establish a firm relationship.
anger, They weren ’ t supposed to arrest me . 
anger, Why are you being so nice to me ? Don't think for a second that I trust you . 
fear,When I entered the operation theatre and underwent a difficult operation.
neutral, Absolutely . 
anger,My fiancee and I were at my parent's place watching TV. There were  only two TV-chairs and we were sitting on them when my drunken brother came in and rudely chased my fiancee off the chair she was sitting on.
sadness,I met some nice people during my holdidays. When they left I knew that I would never see them again.
sadness," Www , man ! "
anger,"` No , "" she replied briefly , feeling more and more resentful . "
fear,I was afraid of a certain examination although I was relatively well prepared.
anger,"A ex-boyfriend tried to prejudice me before my fianceand his family saying things about me that let his family worried. We had to postpone our wedding and we were already using our wedding rings. To be honest I didn't feel just anger, I felt hate."
joy,I felt happy when I learnt that I had qualified for the grade eight.
fear,Falling off a cliff in the mountains.
anger,"When my neighbours accused my brother of stealing their rose-bush, I was very angry as he had not touched it at all."
sadness,I want you and Sheila to know how very much I appreciate the kindness shown to me in my earlier mood of despondency . 
sadness,"Britt is heartbroken that her eight-year marriage to toyboy husband ` Slim "" Jim McDonnell , 31 , is to end in divorce . "
neutral,What ’ s the plot of your new movie ? 
joy," Oh , thanks , professor Donald . This is really very nice of you . "
fear,have to drink water so that the kidneys are not sick !! :(
joy,"Then , as could happen with him , he felt a deep despondency replace his feeling of elation . "
fear,Being driven by friend who suddenly swerved and skidded a little. It was night and on a long trip. We ended up on side of road.
joy,"From the other end of the table Ymor watched with mild amusement , occasionally feeding one of his ravens with scraps from his plate . "
neutral, Then what ? 
fear,On May 20th I got a summon to appear in court on May 28th 1985 on the subject of impregnanting a school girl. I really feared of standing in the court in a few days time after this notice. I was also embarassed due to formal approach that was expected of me to the Principal.
joy,I 'm delighted to learn that his advice has been sought in the present enterprise . 
anger,"During the Christmas holdidays I wanted to invite my brother, his girlfriend and their child for dinner. When I said to my brother's girlfriend that I would like them to come at my place for dinner, she refused and never mentioned it again as if I had never asked her."
neutral, Grannie always tries to stay fit and healthy.She is always making us kids eat the proper foods . 
anger,A colleague asked me to study with her. I could not explain things as perfectly as she had expected. So she reacted in an aggressive manner.
neutral," No , this is a focus-free camera . All you have to do is point and press the button . "
neutral," Sure , I have . Will you join ? "
fear,We nah  ah  nah ah #nobody &#xA;We nah #talk from #nobody &#xA;No bowy nah badda Dan weeeee &#xA;#suckyuhmummapussyhole
joy,When my application for studying the masters degree was accepted. 
sadness,When I failed an exam.
joy,Selling my used car.
anger," Well , he made quite a few mistakes on the monthly report and when his supervisor found them , my manager blamed them on me ! "
sadness,"She didn't want to get sad now , not now after it had been so good . "
joy,"I was in a dancing-tavern and the atmosphere was one of waiting for the end of the world.  Suddenly people began dancing wildly, inspired by the band.  An unbelievable experience : wonderful that even Finns sometimes flare up and forget to think \what others are thinking of me\"".  It was delightful to dance to one's heart content."""
joy,Professor Winston said : ` I 'm thrilled to see them all here . 
anger,She stopped as she saw the look of annoyance on his face . 
sadness,When I think about the short time that we live and relate it to the periods of my life when I think that I did not use this short time.
joy, I'm so honored that you thought to ask me . 
neutral,does your family have a record of your ancestors ? 
neutral, Why not ? 
sadness,I was sad when I heard that my cousin died because of being bewitched by her husband's second wife.
joy,"This would normally push up her heart rate but with her pulse already racing due to the alcohol , dancing and general party excitement the increase is not as noticeable as normal . "
joy,"When after 10 months of national service I was \downgraded\"" and did not have to do the remaining 5 months."""
neutral," Yes , 50 Yuan per month . "
anger, No ! ! ! 
joy,When I got a record as a gift from a friend.
joy,"Cranston repeated , fighting hard to control the excitement in his voice . "
anger, Why are you so bitter ? No one tells worse joke than you . 
sadness," I am sorry , there are so many travelers that all our tables have been booked on that day . "
neutral, You will . 
fear,I was afraid when my dog ran out through a crack in the fence when  a train was coming.
sadness,A very close friend left me.
anger,"One day, when riding on a bicycle path, a car coming from the opposite direction forced me to get off my bike although I had the priority."
fear,Chatterton did not sound unduly worried at that prospect . 
fear,"No-one seemed concerned that the museums , the temples of culture and art , were subjected to such indignities . "
sadness, I have been working on it for a whole month and it's too late to write another . Just think of all my hard work that goes for nothing . How could I do such a thing ? 
anger,But he still feels miffed and mystified as to why manager Kevin Keegan discarded him so readily from St James ' Park and why no other Premier League clubs were willing to hire his lethal skills . 
sadness,My mother's death.
neutral," Oh , yeah ? "
sadness, That doesn ’ t make any sense . 
anger,"When I miss the train and I am late, and I have to wait half an hour for the next one."
joy,"His delight and sense of wonder at the growth of his baby were erratic as other interests pressed , but real enough . "
sadness, Our red underwear didn't do any good at all ! 
fear,"For all those years you've protected the seed, it's time to become the beautiful flower.~S.C. Paul   "
sadness,Finding out that the university will give first priority to qualified practioners and clinical years to go to your English lectures.
joy,"Whether or not the Palace actually arranged for the drawing to be removed , there can be little doubt that they were delighted to be rid of it . "
fear,"At school, I had acted against the will of the group, and the next day they promised to take revenge on me."
joy,"I had a picnic with old classmates, we chatted and played games."
anger, I can ’ t believe she would do that to you . It ’ s so dishonest---and rude ! 
neutral, No . 
joy, Yes . 
sadness,"When I heard about the death of Frantois Truffaut, the French motion  picture director, on the radio.  I had planned to go and see his last film."
fear,"One fears many things, for example one fears going to the dentist. but as far as I am concerned this feeling is connected with the examination session."
sadness,Finding out that the girl I like does not like me.
joy, About 6:00 . 
sadness,Always when I get separated from my friends and relatives from my home town.
neutral, Yeah ! 
sadness,"The night outside was drizzling with rain , and everyone except himself hurried for a cab ; the flower-sellers were disconsolate . "
neutral, Calm down . 
neutral, Yes . 
joy,"When my fiancee travelled 2000 Km to visit me, and I hadn't seen her for 4 months."
joy,"I had been very weary all week - no letters, no phonecalls, no visitors and then my younger sister came with some cheese, a card and some pocket money for me; and she told me that she was working now."
fear,"Tigers up 10, 34-24 with 4:50 left in the first half. South Alabama coach Ronnie Arrow calls another timeout. Told you we smell "
fear,"When I was 8 years old, I would usually come home from school with my mother in a car.  For the first time I had to take the school bus, and I mistook the bus stop and found myself two kilometres away from where I lived.  I was very scared, wondering how I would get back home."
anger,When they denied a job to a person that I propsed giving political reasons that has nothing to do directly with the professional level.
joy, You are doing the waltz wonderfully well . 
joy,A friend of mine often had difficulties with her parents. Once she had a child she had a better relationship with them.
anger,"When an acquaintance of mine beat up another person for no just reason, and thus showed off his power."
fear,When I saw a ghost.
neutral, His nose is out of joint because we forgot to invite him to the party . 
joy,"You could make a fortune , "" she said in genuine amusement . "
fear,only thing holding me back.
joy,"I sensed such a feeling when I understood I was admitted to the University. I was at home, the atmosphere was still, though I myself was full of suspense. I tried to do different things. When the telephone rang and...! Yes, of course there were other situations when I felt a similar feeling but I was unmindful of them."
joy,I felt very happy when I was accepted at university for my studies.  I had not expected this as I had been ill during the exams.
anger,When someone told a secret I told them not to tell.
neutral, Great . 
neutral, Do you really think so ? I don't . It will just make us fat and act silly . Remember last time ? 
anger," Please explain because it makes no sense to me . How can a girl ’ s routine be so complicated ? You get up , you shower , you get dressed , you brush your teeth , you ’ re out the door . Half an hour , tops . "
sadness,"My sister, whom I like very much, asked me for a favour which I refused her for some flimsy reason. Some time later I felt sorry for that and something like sadness."
sadness,I've just been a little depressed lately . 
joy,When I got accepted to CAL.
joy,"` They are naturally excited about getting the championship back after 33 years , "" he said . "
fear," Hello ? Yes , someone has passed out at Dongle Ave . and 2nd street . He isn't breathing and doesn't have a pulse . Yes , my friend is performing CPR . Ok , thank you . They are sending an ambulance . Here , let me help . "
neutral, Who was it ? 
joy,When I got myself the kind of girlfriend I had been hunting for a long time.
joy,When I told my girlfriend a joke openly and frankly.
fear,@Soundplatinum3 Thank you so much for tonight... It was truly a blessing If God did give then where did it come from 
anger,To my great annoyance I found myself jealous . 
joy,"` Well , he was pleased when you agreed to this . "
neutral, She loves to nitpick and criticizes everything that I do . I can never do anything right when she's around . 
joy,Article published.
anger," I know , Blake . But you ’ Ve been avoiding me all morning , and we have got to talk about this deal with the Mc Kinsey Food Company . "
neutral, Only one . 
sadness, Ashes to ashes and dust to dust ... 
joy,As I set off I had a fleeting glimpse of the leer of pure delight on Simkin 's face . 
joy,When I passed an exam.
neutral, But he was trying to beat about the bush . And my talk with him was fruitless . 
neutral," Oh , he ’ s fine . Kids seem to grow up very quickly nowadays . "
anger,"I was angry when my sister began to talk nonsense and to laugh at the way I swept the room.  My anger grew (I tried to control myself).  After telling her to leave me alone, I vented my anger on her as she did not obey me."
sadness,"When I knew that a person that I liked very much didn't react the way I would like to, even that I knew about his feelings for me."
fear,I was camping with a friend of mine and we spent the night in the forest.  I could not fall off to sleep and could clearly hear noises from outside (steps ?) approaching our tent.
sadness,"Aside from the fact that Jill is quite capable of carrying her own books , her glumness could easily be due to being a young lesbian forced to suppress it and wishing Jack would take his stupid pick-up lines elsewhere . "
neutral, A second language is always difficult . 
neutral, I guess so . 
neutral, why ? 
joy,"When I stood first in the B.A exams.  Earlier I had heard of these boys and girls who were toppers, but when I first heard of me having topped I could not believe it."
anger,Physically fighting with my girlfriend because she just walked out of a room of my friends and had pushed and cursed at me when I went to find her.
fear,is such a weak emotion that's why I despise it.
anger,"Agnes noted with alarm that a pink flush was suffusing Dorothy 's face , a sure sign of temper , and really , thought her loyal assistant , she had every right to be cross under the circumstances . "
fear,It was not long ago when I and two of friends of mine got quite drunk and one of them began to rave under the influence of the alcohol. I felt fear of what could have happened.
fear,Finding out the great difference between China and the West in science.
sadness,My sister bkoke her leg.
joy, Ok . Take care . Have a nice journey . 
neutral, I agree . You can't expect a close relationship with a dishonest person . Those are the people that will turn their back on you when you are in need . 
fear,Walking on a dark street with noone around.
joy, You're dancing so well . 
sadness," Yes , but there is nothing inside the drawers or on the desk . "
fear,We were on the road in a car when a lorry bypassed us.  We had to swerve and we almost got run over.
sadness,A grief-stricken Mr Ellis said yesterday : ` It 's a nightmare . 
neutral, I see . 
joy, great . I ’ m looking forward to it . 
sadness,The end of a relationship (after 4 years) by doing this I hurt the other person very much.
neutral, See you . 
neutral, Yes . 
sadness," Yes , I'm serious . I'm really sorry about missing your concert . "
sadness, I don ’ t know . I didn ’ t really feel like going out . I guess I ’ m feeling a little homesick . 
fear,@s_utter I was terrified as well. It made me not ever want to celebrate Christmas in Middle Earth.  
neutral, But what do most people think about it ? 
anger, Don ’ t tell me what to do ! I ’ ll get to it when I get around to it ! 
joy,On my birthday when several good friends came to visit me.
joy,When I was making music together with my friend. It sounded very good and we were very satisfied.
neutral, Ok . 
anger, My car won ’ t start ! Stupid old car ! 
neutral, Why ? 
sadness,When my boyfriend said he did not want to see me anymore (which turned out to be untrue).
neutral, It's 9:30 . 
fear,When a thief entered the house in which I was sleeping.
joy,I received a letter from a friend whom I was missing
joy,When I heard that I had been selected for the university.
fear, I'm scared . 
joy,The birth of my first child.
fear,@LumixGoals who will also increase our wage bill? No sense bringing in anyone. What message does that say to our yound talents? 
anger,"Oh , my goodness . The traffic is crawling . "
sadness,"When I heard that my girlfriend was getting married to another person, I felt very sad.  That day I did not eat anything and kept thinking of her all day long."
sadness,"When a girl did not answer a question, concerning my love for her, put forward to her."
neutral, Where to ? 
fear,Before examination.
joy," No , thank you . "
anger,"When I was young, I became very angry as I was not allowed to stay up all night for the fair in my town."
fear,First time in anatomy.
fear,"@Toop99 Oh god, the drunken disorderlyness on Sat night was outrageous and the has set in nicely! Hope u had a good one "
anger,Insulted by other people in the shop.
joy,When my children were born.
sadness,Determinedly she put her worries and the root cause of her despondency behind her and tried to think more cheerfully . 
joy,"At a success of mine, at a real achievement."
fear,"I studied medicine for several semesters and at that time I developed a great fear of examinations. I was most afraid of my examination of anatomy. While other students were examined, I was dissecting. I was able to hear everything and was waiting with fear until it was my turn."
sadness," I don't know . She always said I didn't love her , but I did . "
anger,"Recently a good friend only called me when he needed something. He never said \please\"" or \""thank you\"" or any other kind word."""
sadness," I know , Mr . Douglas . But I am really sick . "
fear,"I was interviewing a gurl and she flipped the tables on me by questioning me in the freakiest way ever! The rapist got mind raped, ppl! "
fear,In life there is either  or -I pick #confidence ~David Murphy
sadness,It was last September when I felt very sad. It was when I heard that I was not selected to study in the University of Malawi.
anger, Fine ! By the way would you mind not slurping your coffee every time you have a cup ! 
neutral, And that ? 
fear,F.E.A.R. - False Evidence Appearing Real.  #quotes #quote #kktny #ff #follow #kardashians #kardashians #kuwtk
fear,Not applicable to myself.
fear,"I was testing my new roller skates in the street, suddenly a dog ran barking in my direction, very threatening. I was very startled and terribly upset."
neutral, Sure 
sadness,When my grandmother passed away.
neutral, my boss . 
fear,Being harrassed for being gay; suggestions of being physically beaten - acting as informal bouncer in a gay bar.
neutral, OK . 
sadness,"While he went up to the bar to order , Ellie settled back in her seat , and , with a rather sad light in her eyes , watched him . "
neutral,"Hey Lydia , what are you reading ? "
joy,"When I was 17, I had a mystic vision. I melted into a dazzling light, which omitted perfect love. The physical experience became unimportant, I heard or saw the words overcome egotism. The feeling of joy remained for month after that experience."""
sadness,"While walking through an old mining area, I unwittingly disturbed a wallaby which, in its resultant flight, accidentally fell down a deep mine shaft. On investigation it seemed uninjured, but it was impossible for the wallaby to get out, and also for me to get it out of the shaft. To prevent its suffering a slow death, I shot it."
anger,"Busking or playing musical instruments in the Underground , to the annoyance of other passengers , is an offence "
neutral, OK . 
neutral, Fifty yuan . 
anger, That's all right . But why were you so rude to me at lunch . 
joy,I passed my MCE Examination. at first I was worried but when I heard my name I had joy in my heart and I arranged for a trip to attend a wedding ceremony.
neutral, What signs ? 
fear,"I was camping in an old broken hut which had no lights.  I had brought along a lamp which was not working very well.  The door made strange sounds and I was sure that strange things were happening.  The most terrifying bit was that there were many wardrobes in the hut and everytime that I looked in the glass of the wardrobe I felt that there were \objects\"" behind me.   The whole night was spent in fear and restlessness."""
fear,"` And I 'm frightened that if I go down to the cellars I might die . "" "
sadness,"The death of a relative, friend, or someone I esteem."
neutral," OK , you can stop now.It ' s time for the dance class . "
anger,She shot him a look of exasperation . 
neutral, Sure . 
anger,I saw a report on T.V news on apartheid in South Africa. 
sadness," Well , he's become friends with a couple of older boys who are in a band . And one night last weekend , he came home really late , way past his curfew . "
sadness,But why does Mr Ross always look sad ? 
fear,Before an examination: I had the fealing that I had not learned enough.
anger,"The trick was really intolerable.  They hid it, and I was worried and restless all day.  When I saw them I really wanted to slap each one of them."
anger,"It joined me for the rest of the holiday , much to the annoyance of my fellow passengers . "
neutral, Why not ? 
sadness," I know , it's not as I had planned . "
neutral, Tony Bush . 
neutral,Freeze ! 
neutral, Visa . 
anger,You didn't ring me last night.You said you would . 
neutral, What for ? 
neutral, I won ’ t damage it . 
sadness," Oh . I enjoy watching boxing on television , too.What a pity I missed it last night ! "
anger,I shared a secret with a friend and it later turned out that he had revealed it to another person with whom I didn't get along very well.
sadness,"When I realized the burden it was for my mother to look after all of us, all by herself."
neutral, Why ? 
neutral, Chicken ! 
sadness,When my friend (girl) went abroad for two years.
joy,I received money from my father at a time when I was completely broken.
sadness,My friend not allowed to go to the English lectures.
fear," Ar ! Dad , the power went out . "
neutral, Engaged ? 
joy,Yesterday when I received a B on a history midterm. I felt overjoyed after having received C's previously.
neutral, No . 
neutral, OK . 
sadness,One of my good friends had to migrate to America.  Our friendship had developed quite well and it was a pity as our friendship would fade.
fear,"I thought that I would be scolded for a comment I had made, which I should not have made."
anger,Made a statement that other people did not believe.
joy, I heard it ’ s a very good movie . 
joy,` His gratification was almost unbounded when on arriving at the Belts of the Murray he found not only numerous new Species but new forms of Birds . 
anger,When a colleague was rude with me because she didn't understand the subject about which I was discussing.
sadness, Yeah . My whole GPA is screwed up now . 
sadness,Anne was sad at the death of the Misses Dolan but too much was happening for her to dwell on it . 
joy, excellent ! That sounds like a plan . 
fear,"The day I was nearly stabbed to death by ruffians who wanted to take my money.  I refused to give them any money and they started running after me, I ran into somebody else's house to save myself."
fear,When I was caught in an elevator and it got stuck between floors.
neutral, it must be very demanding . 
joy," You must have been prepared for a long time . Some statistics in this presentation are not easy to find , right ? "
sadness," Oh , I just can't forget it . "
neutral," Woo , easy . "
fear,Mr Carruthers said that the vast majority of evidence was over but acknowledged he was concerned that Mr McTear would not be able to conclude his testimony . 
sadness, Rather . I'm afraid I didn't do very well . 
anger,"` I am practical , "" Jessamy insisted with some annoyance . "
sadness, I don't think you really want to hear about it . 
anger, You ought to have worked harder then you wouldn ’ t have failed your exams . You have to take a job and study . 
neutral, A B plus . 
neutral, Why not ? 
neutral,You're late . 
neutral, No problem . 
joy," Maybe so , but do you have any idea how much this one is worth ? "
fear,"Lo ga takut untuk mencintai, yang lo takutin adalah tidak dicintai balik.  "
sadness,I was sad when I saw that a beautiful girl was not attainable.
joy,"As Christmas approached , the excitement of preparation began to get through to her . "
neutral,Time flies ! 
fear,A certain night during initiation. 
joy, Oh ! That's much hetter than I did . 
fear,Yanto realised to his horror he was now the nearest man to the exit bar . 
