Emotion,Text
sadness,At the begining of a new course one is afraid of encountering problems one can not manage.  Thoughts revolve around failing the subject and the consequences it would have for the future.
sadness,"And Ryan had spent more than one night under the roof with her , she remembered in bitter anguish . "
joy,My father stayed abroad for one year. He does not like to write letters because he makes ortographic mistakes. I never had a good relation to him. He wrote me a letter in which he said that he loved me.
fear, It doesn't work . It looks like it's broken . I need to get to a hospital . You should drive me there . 
fear,"A teacher wanted to instill a certain opinion and a certain behaviour into myself, what I refused. I was afraid when I saw him."
sadness, Poor Femi . Taylor's death must have made her realize that she still cared for him . 
anger,"At a restaurant I observed how the gypsies tried to get money by cheating the foreigners i.e non Swedish speaking.  My anger had nothing to do with hatred against foreigners, but it was an expression of the anger I feel when I see people being used ."
anger,"` I 'm not ashamed of it , "" she retorted , taut with anger over his reference to her mother . "
anger,"I was coming home in a taxi with a fellow worker of mine.  He was criticizing my earlier conduct towards him, which to my mind was unfounded.  When I reached home, I ran out of the taxi and slammed the door."
sadness,When I thought for an instant that a very good relationship with a person had finished.
joy,"When two female classmates and I were having lunch, we chatted and  cracked jokes, I was very happy.  However, I felt that I may have  said something inappropriate which might cause them to have a bad  impression of me."
fear,"When I came back from work one day, the friends of my son told me that he had not come back from school and that he was lost."
anger,Mr Jones exploded in anger . 
joy, Perhaps you are right . But I still need some time to recover from the failure . 
neutral, No . 
joy,When I understood that I was admitted to the University.
fear,I find myself sprinting but it doesnt hurt as much on my hamstring no more...is leaving
fear,Jim could nonetheless tell by his anxious face that something was wrong . 
fear,When the week for Exams came. I got afraid as to how I would tackle the questions.
sadness,Now it makes me sad to think of them growing up .  
anger,"Oh great ! This stupid computer froze again ! That's the third time today ! Hey Samuel , can you come take a look at my PC ? It's acting again . It must have a virus or something . "
joy,Last Summer I achieved someting that I had been wanting for a long time.
neutral," Www , man ! "
sadness,"When the grandmother of my friend died in a hospital. My friend was crying and I was sad, too."
joy, It's on 7th Street . 
neutral," Oh , yes . I love playing badminton , table tennis and computer games . And playing the games has become my favorite . "
sadness,The boy was broken hearted and inconsolable . 
anger,In me battled a flood of relief at being reprieved and anger at such vile deception . 
neutral," I agree , but I would find it difficult to stop using my car . It's just so convenient . "
fear,"She was particularly concerned when , shortly before her wedding day , she discovered that Prince Charles planned to give his friend a bracelet inscribed with their nicknames ` Fred "" and ` Gladys "" . "
joy,The day I heard that I passed the high school exam.
joy,"Every time they got near him , he backed off , ecstatic with excitement , tail wagging furiously . "
anger, Fine ! By the way would you mind not slurping your coffee every time you have a cup ! 
neutral, How much ? 
neutral,I have made up my mind . I am getting a tattoo . 
anger,"Some people simply were miffed by the red tape in applying for victim identification cards to qualify for the 100,000 yen ."
anger,"Mexico , too , was miffed because the Telmex telephone company can not gain entry to the American marketplace ."
sadness," No , I'm sorry we don't . We accept credit cards and cash . "
neutral, Not really . Very few people get married beforethe age of 20 . 
sadness,My boy-friend an I seperated on his initiative.
fear,Before an oral examination - which I did not take eventually.
anger," This ref needs glasses . Hey ref , open your eyes ! I can ’ t believe he didn ’ t see that ! "
fear,Few years ago my father was very ill. He stayed at a hospital for a long time. Then I experienced that terrible feeling that I might lose him.
anger,"Lissa gazed up at him , at his vexed expression , and tried to quell the smile that pulled at her lips . "
anger,"New Year's Eve party in the country, I hardly knew a person; my partner spent most of the time at the bar. I had little opportunity to get to know people because our table was separated and my boyfriend's parents were present."
sadness," Yes , it was . I managed to sort out the problem , but I was tied up with the matter for over an hour . "
neutral, He is fine . 
sadness,Lecturers being unfair to me in reports.
anger,A teacher at my former secondary school forced my darling to marry him.  The girl tried to refuse but her parents would not leave her alone.
fear,When I am out in the dark and a suspicious looking character comes towards me.
joy,When I could study at university.
anger,My sister had promised to help me to do a translation from English into German. But the day I needed her she told me that she was busy - I was very angry.
sadness,"I worked for seven months in a factory, and made friends with a fellow worker.  Later, I visited my former fellow workers and was told that, while in the army, my friend had shot himself."
neutral, do you have a car ? 
anger,When the bus driver failed to stop and pick me up at a bus stop.
sadness," I didn't do well in last exams . If my father knows it , he will beat me up . "
neutral, Not at all . The feedback from audience has been great . I care about what they think more than what the critics think . 
neutral, That won ’ t be a problem . 
neutral, Pardon ? 
neutral," ok , we will . How do you get around in the evenings ? "
joy,"When I saw my 16 year old sister at home after having waited for her all night, not knowing where she was."
neutral,"On , darn . The grocery store is closed . "
sadness," Oh , no ! I can't have failed . Are you sure ? "
fear,When my father was ill and was waiting for the results of his tests.
joy, that's what friends are for . 
sadness,The death of Jaya Prakash Narayan caused a great deal of sadness as I believed that he was the only true democrat and a ray of hope on the Indian horizon.
joy,"My sister gave birth to twins, healthy ones."
sadness,When I am alone and listen to a song which I like very much and which I had listened before together with friends.
sadness," I ’ d love to , but you know I ’ Ve got another appointment . I ’ m really sorry . "
sadness,When I knew I had to go out with my mother on some errands.
joy,"At the pre-university, I was appreciated as an examplary student by our pricipal.  This is something which made me feel very happy."
joy, How do you like this waltz ? 
anger,I was a prefect at secondary school.  On the sports day I told others that I would take down the names of the people who misbehaved and after some time I sat down for a brief rest.  Suddenly the head prefect came and scolded me in front of others.  I was very angry as there were other prefects sitting and he picked on me.  I thought that a brief rest was not  serious enough to be blamed.
fear,"At about nine p.m., I went home by bike on a dark cycle-track; because of lack of time I had to take the short-cut."
sadness,"Three weeks ago a friend of mine bid me good-bye before going abroad.  I felt happy for her as she was achieving something by making the trip, but I also felt sad as I would not be seeing her for a long time."
sadness,I lead a rather secure life.  The only thing I can remember is a song from the nineteenth century which is against alcohol.  Both the melody and the word (although naive) effected my emotions.
joy,When the Cambridge results came out and I obtained a first division.  I had been thinking that I had not done very well.
neutral," Woo , easy . "
neutral," About 70 , I think . This newspaper article talks about the problems of an aging population . It ’ s a problem that will soon affect most of the world . "
fear," No , I'm scared of cats . "
sadness,"Tolonen nodded , suddenly wistful , his lips formed into a sad smile . "
sadness, That's too bad . I need to discuss these plans with him . 
fear,` It 's actually made me quite nervous about being in London . 
fear,@_AndreasHuebner: is nothing else than perverted #faith. Your ability to fear is a proof of your ability to #believe.
anger,"I was asked to stop studying economics, a field which interested me, by my employers."
neutral," C'mon , don't blame me ! I thought it was a new camera . We could use it.We were even thinking about buying a camera . I don't understand how he could have such a perfect-looking box . "
joy, It's a new concert hall and the acoustics are great . 
neutral, Is he ok ? 
neutral," Just hold me ... I ’ ll always be here for you , no matter what . And together , we can tackle whatever life throws at us . I believe in us , steven . "
sadness,"When I was in Bombay one of my good friends was getting married and he had not informed me about it, this made me sad."
sadness,"When I missed my train this morning, I felt sad for some time."
anger,"Residential workers are faced with youngsters who are not only anxious and resentful about family events , but may also be mistrustful of those who try to help them . "
neutral, Oh yeah ? 
neutral, Didn't I ? 
anger,"For a moment she felt anger at his unfeeling attitude , but common sense prevailed . "
fear,"When a friend of mine discussed with me, I felt fear of losing her. This occurred because we had a missunderstanding between mutual colleagues."
anger,When I failed an exam I thought I would pass.
sadness,"But the address underlines the anguish of Her Majesty 's speech after the Windsor Castle fire when she referred to 1992 as her ` annus horribilis "" . "
joy,"But seriously , I 'm very happy that you 're staying . "
anger,"I was the compere at a party and all my efforts to get the show rolling were thwarted by the immobile, non co-operative guests.  I felt frustation - bordering on anger."
anger,In a discussion the leader wanted to stop because she was of the opinion that we were not involved and she misjudged our reactions as negative. We however only posed several questions which she couldn't answer.
joy,"At a party in which I met an interesting female. We enjoyed eachothers company, while slow dancing."
sadness,I was not chosen for the All English class.
joy, I am feeling very positive .
neutral,Where's Bob ? 
sadness,"My paternal grandmother had died. We weren't close but she was blood. I didn't cry but I was sad, partly due to her death and partly I think, due to the fact that I could not / did not cry."
sadness,"During the funeral of my grandmother, when I saw my mother and other family members crying."
sadness,At rejection / being ignored by a loved person held in great esteem.
joy,When I got to know that I had passed the university entrance exam.  I thought that I had done one of the exams badly.
neutral,You'd better prepare for the examination . 
anger,"My flatmate was asking questions about my relationship with my boyfriend, whether I wasn't treating him as unfairly as I claimed he'd been treating me. As a result, I was angered, and became defensive."
fear,"I was coming home from a relative's place and it was about 9.30/10 P.M.  I felt slightly apprehensive when I got off the bus and started walking towards my place.  I was confident that nothing would happen to me, yet there was this slight feeling of fear."
fear,"As a child, when I was at home alone, I felt in an indefinate manner afraid of the death of my father and mother."
neutral, What if someone got it in their head to give them a tug ? What then ? 
sadness,When my grandmother died.
fear,When I and the person mentioned above had a suspicion of pregnancy.
neutral," It ’ s very simple . Men shake hands , women and children don ’ t . "
sadness, My grandmother just passed away . 
anger,A friend forgot his appointment with me.
sadness,When my friend did not pass the high school graduation examinations.
joy,When I was accepted at university.
neutral, Why doesn't he ask her ? 
fear,"When I was an adoption agent, we put folk thru the RINGER to get kids. But any old Travionica Jenkins can bust em out. And KEEP them. "
joy," thank you , Steve . You're always so encouraging . "
neutral, Do ya ? 
joy, Ok . I'll call you Saturday morning . 
fear,"For all those years you've protected the seed, it's time to become the beautiful flower.~S.C. Paul   "
anger,"I told my boy friend not to park in a certain place because the car would ger towed away - he didn't listen and it was towed away. At that stage, our finances were below the poverty line & it cost us $10.00 - all the money we had to get us through that week (including rent)."
anger, Why didn ’ t you just answer my question directly ? Why would Chinese answer questions this way ? I simply asked if you did it or not . It ’ s a very simple question . And Chinese often give the reason before they would give a direct answer . 
sadness,I felt sad with the two situations I described before. The cat and the school. Sadness was intermingled with the other feelings.
anger,Brother took my money to use for his own purposes.
joy,When my boyfriend last told me he loved me after I gave him an impulsive kiss.
sadness,"On one of our visits we found a representative of the Occidental Oil Company stranded there , looking most miserable and bedraggled in the morass of mud and pouring rain . "
neutral, But they aren't very fashionable . What about these ? 
anger,"Suppressing her annoyance at being called "" Little Sara "" , she replied that all was well . "
fear,"While taking a short cut through the Vasa park, I was surrounded by three people who tried to steal my money.  I was scared and was saved only by the appearance of other people."
neutral, Why ? 
anger,"` Robots , "" he said , ` gave me a means of venting my anger , "" a remark whose logic baffled me until I read another ` Logic alone can not explain this . "" "
neutral, Yes . 
fear,When I took the first year university exams and made a lot of mistakes in the P110 exam.  I was afraid of failing and thus being unable to go to the school of medicine.
fear,"One night, when I got out from the University I saw two strange people near my car. When I got near, they moved away, and then came close again. I had a feeling that they were assaulters. After I left I discovered that the windshield was broken."
fear,I was at home alone and my mother had asked me to heat the house. I put too much fuel into the stove. It began to glow and there was a noise in the whole house as if it was going to explode.
joy,The two observers exchanged amused glances and then wandered away under the trees . 
sadness, I got laid off today . 
sadness,Derby County 's grief at the foot of the first division continues as they went down two one at Crystal Palace . 
anger," The cat has eaten my fish , I'll kill it . "
neutral, Poor girl ! 
neutral, How much ? 
neutral, She's ten . 
joy,"When I went for a picnic in Lonavala, I felt full of joy."
fear,"I saw the world without any borders in my  I was flying under the sun above the trees, no just #love. Dreams are my reality"
joy,"At the same time , I 'm elated and I can go back to the vices I did have , "" said Mr Tyson . "
sadness,"For the loss of a close friend or relative, but you feel grief when you are away from home, too."
neutral, Didn't I ? 
joy,A wave of cheerful elation swept over her as she separated her pound note from Yanto 's fivers . 
neutral, Exactly . 
sadness,"He saw Maud once in the Kurfrstendamm , eating alone in a cafe and looking a little desolate , with a stack of coins already piled beside her plate although her meal had only just come . "
neutral, See you . 
sadness," No , sir . I'm sorry you can't . "
neutral,How are you ? 
fear,"At age 10 my foster grandmother died, I had a fear of dying."
anger,"Sometimes when I go to work my crazy boss (a hyper Jewish lawyer) insists I do things his way (filing, typing, etc.). He sometimes blames me for things I didn't do, and I can't yell back at him."
anger,"I had made an error in planning a programme and had publicly accepted the mistake, despite repeated requests not to bring the matter for discussion a professor kept constantly passing remarks. I reacted angrily.  "
joy,"In order to be admitted to my final examination, I had to pass two examinations. As I had not studied very much, I resigned myself to be left behind. Nevertheless I succeeded in these examinations."
neutral, Terrible . 
fear,Courage is knowing what not to fear. - Plato   
fear,We must not give in to the  must face those things we the most...
anger,"This is the end , Jane . I don't want a girlfriend who goes out with other guys all the time . "
neutral, Heads . 
anger,"One winter day I, unwillingly, was outdoors with my younger brother (10 years younger than me).  I lost my temper on him and wanted to throw my brother down the snow bank we were on.  I pushed him but not as hard as I had wanted to. We were alone the two of us."
sadness,My father won't be so pleased with me as if I was elected.
sadness,I 'm very depressed and have tried to commit suicide several times . 
sadness,I got separated from the man I loved.
joy,When I got first division in the exams before leaving school.
joy," not only our annual sales brake a record , but our month by month earnings exceeded our forecast as well . After a two-year slump , we finally back in the black . "
fear,@YesIamQuESt would it offend you if when I listen to otFailure (the song) I'm thinking about girls?
neutral, What is two hand touch and flag football ? 
neutral," It's easy . If you do exercise everyday , you can make it , too . "
fear, I ’ d be afraid to jump from that height ! 
fear,I had an important amount of money with me and felt fear of being assaulted.
sadness, My manager jumped on me for my mistake today . 
fear,"He says that Childine must survive because it has proved itself a lifeline for thousands of frightened , lonely and distressed children . "
anger,"Having agreed to share the taxi expenses, three people in the back of the car just ran off, leaving the person up front with the entire bill."
anger,"Now it was the Young King who drew back and , doubtless to their father 's immense exasperation , refused to accept Richard 's homage . "
anger,Someone spread rumours about me.
fear,At primary school the teacher caught me cheating during a dictation.
neutral, Once in a while . 
anger,Bang ? ! Bang ! Bang ! What are the Kings doing at seven o ’ clock on Sunday morning ? 
anger,I know I ’ m going to bite the dust going down this hill . I almost got killed on the chair lift ! This is going to be so embarrassing . 
anger, Get out of it ! It wasn't as good as you think . 
fear,Follow me on Twitter for official @OfficialPWG results and coverage
joy,But some of the younger dons were ecstatic about the election . 
anger,When I see how people around me pass by certain unjustice because of indifference or cowardice.
joy,"She became happier , more settled . "
joy,"` I 'm so happy you could make it , my favourite jockey . "" "
anger,"A man kept a seat taken by putting his coat on it after a while the chair was still empty, I asked him if I could use the chair, he didn't agree for the chair was for his coat."
anger,I was in love with a very beautiful girl and when I went back for my holidays I found her wth another guy who she said was just a friend.  Later I found them together and was convinced that there was something fishy.
joy,I had a very pleasant conversation with one of my friends.
neutral, No regrets ? 
joy, That will be great . 
neutral, It's us . 
fear, It's not a cut . It's a gash ! It's bigger than a cut ! Ah ! I need a doctor . 
fear,"It so happened that while staying at anaunt's place I discovered that I was afraid of sleeping in pitch darkness.  The room which my sister and I were sharing had no light, and I would refuse to sleep without having the light of the adjoining bathroom switched on."
anger,"A girl whom I trusted and with whom I had shared personal, confidential matters twisted the facts and told it to a common friend of ours.  When this common friend told me the version my friend had told her, I was angry."
fear,"Startled , and by now more than a little frightened , Patrick headed for Foyles , hoping to lose his followers in the bookshop 's maze of nooks and corners . "
neutral, Yeah . 
neutral," Yes , I ’ m the manager here . What can I do for you , Madam ? "
neutral, No problem . 
neutral, No . 
neutral, Thank you . 
sadness," Sorry , I'm very near sighted . "
joy," I do not know what I could imagine , but I confess that I have seldom seen a face or figure more pleasing to me than hers . "
neutral, 650 Yuan . 
neutral, What for ? 
joy,A smile of amusement played on his lips as he studied his unkempt prize . 
neutral," Oh , I see . "
fear,Once I spent a night with a friend at the secondary school. We told each other horror stories and suddenly we heard uncanny noises. I was terribly frightened.
joy,When I was informed that I had been accepted as a student of Psychology.
joy,When I met my girlfriend again in another town after a long separation.
anger,I went to a fair where a guy who was drunk kept bothering me and in the end I got really angry.
anger," Well , you might pinch your eyelid ! Or lose an eyeball ! "
joy, The situation differs in person . 
anger, They arrested me without probable cause . 
neutral, Really ? 
neutral, Sure . 
neutral," But some women do shake hands . And now a lot of children have such good manners , they shake hands too . "
anger, I know ! But it's really important to her ! Her whole life could be ruined by this man ! 
neutral, Good . 
fear,When I had crossed London forest I heard that there was a rabid hyena just near the path in the forest.
fear, No way . I will be scared out of my wits . 
anger,"When I arranged our holiday in Paris, and my girlfriend raised criticisms all the time."
anger,"Boyfriend \chatting up\"" another girl."""
fear,"The RSPCA says they will now try different tactics , attempting to gain the animals trust so they 're not so frightened of people . "
neutral, I hope so . 
joy,When I married my wife and took her home for the first time.
anger, You are always like this . I've told you many times not to tell her . 
joy," I ’ m glad . We have only about twenty things here , and I ’ m in a hurry to get home . "
fear,LOVE LOVE LOVE Da Onli Thing I Truly 
neutral, That's the style ! You just wear boxers . 
fear,It's hard when you something you have to do! Just because you don't feel like you're ready... Am I ready to #JUMP???
joy, Fun for you ! Do you get to do anything you want ? 
neutral," You should change your attitude , or you will not pass the course . "
sadness,"Watching an old lady running up the street to catch her bus and miss it, it reminded me of my own mother and how dreadful it would be to be her in the same situation."
anger, How many chances should I give you ? I've given up on you ! 
neutral, Laptop . 
neutral,I would like to register for a class today . 
joy,"When Christmas holiday started, I felt very joyful when I finished my last exam."
joy,"Found out that the girl I love loves me, too."
neutral, I like baseball and basketball . 
neutral," OK , next ? "
anger,"I went to the school library and asked for a book, but the librarian told me that there wasn't such. However when an other colleague asked for it she gave it to him."
fear,The Cloud just asked me lotza personal questions re: myself. Been avoiding upgrades awhile due 2this  #CylonTakeover #fb
fear,This caused a good deal of consternation and dismay in Westminster . 
sadness,And Glenn Close 's stubborn and pain-ridden performance as Sunny makes you sad for her and hate her at the same time . 
fear,"They caught a suspicious individual one evening , and turned him over to the police ; but he turned out to be a frightened bilberry-picker who had lost his way . "
anger,"Leonora lay rigid in his arms , resentful of being carried about like a bundle of laundry . "
fear,"I was alone at home, in bed reading a womens' magazine in which there were storiees of paranormal experiences.  My leg was itching and I stretched my hand to scratch and I felt another strange hand. (later I realized that it was the corner of the blanket)"
sadness,Of course I like them ; if I didn't I 'd be utterly miserable . 
sadness, My bad.sorry ! 
neutral, Bye ! 
anger,"When my friend, as usual, forgot the tickets at home for a performance.  We missed it."
neutral, Do you have an online edition of that magazine ? 
sadness,My uncle died - I felt sad at the funeral.
anger, That ’ s so unfair ! 
sadness,When my girlfriend decided to finish our relation.
neutral, Really ? 
neutral, Where did you learn it ? 
joy,At my wedding - standing with the man I love and acknowledging that fact to members of family and friends.
sadness,"When my husband lied to me, tricked me and when I had to leave my home."
joy,"Travellers might get used to jet-lag in the sense that they learn to live with it , or they might find it progressively more irksome as their initial excitement with travel begins to wear thin . "
