Emotion,Text
joy,"For a few days I felt very miserable, distressed and listless, with crying fits. When this was over I felt very happy, although there was no special reason."
anger,"A friend of mine played a joke on another friend over the telephone.  This friend, crying, called me and I got very angry and made the other person apologize."
neutral," Oh , I see . "
sadness,Records must not be based on the measurement of subjective impressions such as the number of times parents felt depressed about their child 's behaviour . 
joy," Well , I like collecting matchbox ! I'm not sure if that counts , though . "
joy,I've been chosen to plan the next family reunion . 
fear,A friend and I were going to have a study session together in which we quiz ourselves in biology material. Because I believed I didn't study enough. I feared I would fail.
joy,"Audiences were thrilled , box office cash registers jingled and careers were made . "
sadness,But Miss Van Cheele was terribly sad about Gabriel-Ernest . 
neutral," oh , really . That is great news . What does he look like ? "
fear,My father had been drinking and I feared him when we went to bed at night.
neutral," Eh , so so . "
joy,After having considered it for hours I was able to overcome my scruples and to call a friend with whom I had fallen in love. I realized that my decision was right - and was very glad.
joy,"This happened when I went to check my first year results, I had  thought that I would fail and I found that I had a clear pass in all my courses."
neutral,how do you usually get to school ? 
joy, Look after yourself . Bye . 
joy,When I won my car. 
neutral," Yes , Jane invited me for dinner to this new restaurant which opened near us . "
sadness,Julie is devastated to discover she is adopted and she sets out to find her natural parents . 
sadness, That's too bad.They ' re such good company . 
sadness,My best friend had failed Exams. She had to leave and so we got separated.
anger,One minister was miffed yesterday when he found his seat occupied by a journalist talking to a fellow cabinet member before the meeting began .
neutral, Coco Lee . 
sadness,When my flute-teacher was replaced by a new one.
joy," Sounds good , when ? "
joy,I was admited to the Chinese university of Hong Kong.  The day the results were announced I looked in the newspaper and saw my candidature number.
joy," Good , happy birthday to you ! "
joy," Sure , I will . Thank you for inviting me . "
neutral, I liked it . 
sadness,When my brother (5th in the family) passed away.
joy,He broke off as Jim Miller let go a Indian whoop of relief and delighted grins spread across the faces of everyone in the group . 
sadness,My girlfriend let me down badly 3 times in one week. These instances summed up all the negative aspects of our relationship which at the time seemed doomed to fail.
fear, OK ! I'll call security . 
neutral, I ’ m sorry . I didn ’ t know that . 
fear,"When I was a child, I heard the floor cracking and I thought there was a burglar in our house; I hid under the blanket and trembled."
anger, That ’ s exactly what they did . 
neutral," Don't mixing #cosmetic brands. If it works for you, #goforit @MACMakeupLA @makeupjojo @MakeupByEric @cosmetichappy XO :)"
anger," Yes , I joined your group of bus tour this morning . You promised the journey will last 3 hours and we will visit 15 sightseeing spots . "
anger, Mom ! I'll wear a helmet and I'll drive sane . I promise . 
sadness,"When an uncle of mine, who was close to me, passed away after having had a stroke, before his first daughter could be named."
neutral," Oh , yes ? "
fear,"Les mecs à la sortie du metro 4 à gdn, et qui attendent que tu passes pour degainer leur toupie lumineuse  "
anger," He treats everyone pretty poorly , but the way he treats me really takes the cake ! "
joy,Going to a friend's wedding and seeing many of my old friends whom I had known before I moved to a new district five years previously.
anger,The men got resentful of the women working all hours in the co-op . 
neutral,What's wrong with him ? 
sadness, I can ’ t believe it ! I guess I ’ ll be here until ten again tonight ! 
neutral, Forgive me darling . I'm very tired . 
joy,"Welcome to my birthday party , I am so happy you can come . "
sadness," Only sometimes when I think about it , I feel very sad . "
joy,"To tell you the truth , I wasn't at all pleased about Russell sitting in the same coach with us . "
joy,I started a new branch of studies after having failed a former one.  When I got back my exam papers I was very happy to know that I almost had full marks.
sadness, I'm afraid there isn't . 
sadness,It soon developed into disillusion as the town 's death toll grew and ended in jubilant relief not unmixed with sorrow at the memory of towns-folk who would not return . 
anger,"At the hairdresser's, I got two stains of dyestuff on my new trousers. These stains are not removable, so I cannot put on the trousers again."
neutral," I liked physics . It ’ s all math , really . arcs , curves , velocity , cool stuff . "
anger," I'm serious , Zina . Back off . I have a bottle of pepper spray in my pocket . "
anger, I won't be paying you for this . 
sadness,A) A documentary in which baby fur seals were being clubbed / spiked to death by Canadian sealhunters. Brutally graphic. B) Description of a disfigured orphaned child in Hiroshima calling for her mother.
neutral, A stop ! Wait for the lights to turn green . 
anger, what a bummer ! You set me up ? 
joy, But you agreed to go out with me at last . 
neutral, No . 
joy, The black ball has to be the final ball in the pockets . 
neutral, I never know when to shake hands and when not to . Can you tell me something about it ? 
fear,The of your toes about to get chopped off when you see the cutting knife slip off the bench.
joy,My friend told me he really likes me.
anger,"My mother had for some time been trying to separate me from a good friend who, she thought, was not good company for me.  Finally, at breakfast one day, we had an argument and I tried to defend my friend."
sadness,When I found that my ability to do ordinary work was worse than my fellow mates.
neutral, Now . 
joy, Were you ? your performance was excellent . 
fear,After having slept for a short time I woke up - I had the feeling of someone standing beside me and was very frightened. I had to turn on the light turn on the light for several minutes before I was able to get to sleep again.
joy, Sure . Now you are talking . 
fear,A third group of backbenchers is concerned at cross-media ownership in the new channels under the bill . 
sadness, I had a bad start of the day . I was stuck in a bad traffic jam on my way and I missed my morning meeting . 
anger,"The king was furious at being tricked again , and by nothing more than a pair of animals , at that . "
joy," Well , imagine that ! How old are you ? "
sadness,For not having succeded in getting the job as a translator that I wanted.
fear,Elaine 's voice was concerned but deep inside she hoped he would not decide to go to the party . 
neutral, sounds like he is pretty cute . What do you think of him ? 
anger,"Oh great ! This stupid computer froze again ! That's the third time today ! Hey Samuel , can you come take a look at my PC ? It's acting again . It must have a virus or something . "
anger, Trust you ! You can't even handle simple plane reservations ! 
joy,I was filled with joy when I heard that I had been selected to come here at Kamuzu College of Nursing.
neutral, I'm sorry . 
neutral, So what ? 
fear,When I woke up at night to find a fire spreading towards the bed -rooms.  I was very frightened as I realized that I faced death.
joy,It was the weekend of my homecoming. I saw my sister for the first time in 3 months. She's my best friend and extremely close.
neutral," Yeah , yeah , but today ’ s lesson was all about the creation of the universe . "
neutral," well , we'll be careful . Thanks for letting me know . "
fear,The fear of being hurt in a relationship usually causes you to stay single or fear getting attached to a person.  
fear, It must be a haunted house.Are you frightened ? 
anger,"When my aunt scolded me for something I was not responsible for.  A boy had come to our gate asking for me, my aunt went out to see him.  I had neither met nor known the boy."
fear,"Doris , I'm glad you're home . I'm terrified . I don't know what to do ! "
anger,"He made a good living , and seemed resentful of his wife 's decision to take in a lodger . "
sadness,When a close friend drowned in the American River.
sadness,Disappointed love. The girl made an end to our relationship while I thought she was in love with me.
neutral," Don ’ t worry , I can handle that . And I know if the boss is there , even it is an informal evening , it does not make a good impression to get totally drunk in front of him . "
anger, Yes . But why do I have to fill out a form anyway ? This is the emergency room . 
joy,One of the greatest joiy was when I succeded in acquiring a motorcycle through my own efforts.
sadness,"Sometimes, when I'm alone I am seized by this feeling. But it always helps me to come round and at the same time to judge if it is worth. Very often this feeling is caused to me by people - friends who I love and respect."
neutral, Yes . 
joy,Returning to school and rejoining my girlfriend after 3 months of separation from summer.
sadness,When my first girlfriend an I left each other.
sadness,Kurzlinger hated Voss for what he had done and the man 's grief for his murdered love was not to be underestimated . 
sadness," Well , I'm leaving Japan and I'm going back to London , tomorrow . "
fear,@johnnorlin  tells us that we've sacrificed more than others. tells us it's time 2 worry about the future. &#xA;&#xA;Luke 9:3
anger, They soud like the neighbours from hell ! 
anger,An exasperated Galileo was able to show up the inadequacy of his rival 's position in a characteristically witty way . 
fear,"His horrified mother made a public appeal for the return of the ring , given to her by husband Alfed 18-years ago . "
anger," Oh , you men ! You're all the same . "
neutral, Winning is a piece of cake to me . 
joy,"Mr Mitterrand appears so delighted with the ultra courteous Edouard Balladur , that some Socialists wonder whether he has at last found the prime minister of his dreams . "
fear,"I lived in a flat with a couple. The woman was so jealous of me, that she sometimes had crying fits. Eventually her husband could not stand that any more and wanted to kill me."
sadness,My uncle died in the Vietnam War.
fear, I'm afraid you are beginning to look a little overweight . You really need to stop smoking . That's the main reason you're unhealthy . 
anger,When people without my permission pry in my belongings and take things out of it.
neutral, In Boston . 
joy,When a cousin of mine was discharged from the hospital after       a long illness.  I had thought that this illness would never end.
anger,When I had an argument with my best friend and I thought that I was right and she was not.
sadness,When I had to come back from my village last Christmas.
joy, I ’ m sure I ’ ll like it here . 
anger,He looked at her with exasperation when she just gazed at him with wide deep blue eyes . 
sadness,When a colleague failed to contact me at the arranged time.
anger,"At a school dance when my supposed \best friend\"" kept walking away from me whenever I came near her."""
joy,"Isn't this lovely weather ? Will you help me water the flowers , Jack ? "
sadness," I've finished the first draft , but the professor said it's poorly written . I have to rewrite it . it's so depressing . "
anger, I am really looking forward to getting away from you . Far away from you ! 
fear,"I was travelling back home by boat with two friends of mine after a lovely holiday trip.  The night and the sea were dark, and the wind was blowing.  I feared that death was there on the boat, I somehow felt sure about it.  I feared being left alone."
joy,"The day I got to know that I would get a shared dwelling with my boyfriend.  My parents place was getting a little crowded with my growing bother wanting a room to himself.  I first felt doubt, then joy, but also sadness.  The feeling of joy was the strongest."
neutral, Do people get married young ? 
neutral," Oh I remember , I cut terrible calls , and you didn't say anything about it . "
fear,When I failed my first exam at the Higher Institute.
sadness,"He was a plodding lugubrious fellow , and we were delighted with his Wodehousian name . "
anger,"Ok , let ’ s go through this one more time . I don ’ t want anymore ruined or dyed blouses ! "
neutral, What happened ? Quarrel again ? 
neutral," Hi , Jim . "
neutral,"Do you speak only English in the class , or does your teacher explain everything to you in Spanish ? "
sadness," Oh , sorry to interrupt you . But I am calling to say goodbye to you . I am awfully sorry to tell you that I am afraid I could not see you off at the airport tomorrow , because I will have to attend a very important meeting . "
fear,The possibility of having failed the examination.
fear,"I am a \cantor\"" - I sing psalms in church. Several weeks ago I had to sing too, but the organist did not tell me in time. As I did not know the psalm, I was afraid and said that I could not sing."""
sadness,When on Christmas day my grandmother died. I received the news when I was coming back from a party on the 24th at 5 am.
sadness,When I found out that I could not go to the concert (after buying the tickets) because of a biology test which occurred the morning after.
anger,What a terrible house ! 
joy,Getting into this university.
fear, Too bad . I really like it . 
fear,Ok now im scared. . . Im the only one up in my house. . . I guess im going to sleep. . 
neutral,Who's that ? 
joy,"When I got 21/30 points in an exam of statistics. The result was unexpected and it made me realize that statistics do not surpass my abilities, as I have sometimes thought."
fear,When my relatives and I were in a car going slowly on a frozen road.
joy,"When I received the result slip of the higher level examination (an university entrance exam) and saw that I had a very good possibility of being accepted into the university, I felt very excited."
joy,"I was going to my village, after having been rather oppressed in Madrid. "
neutral," I had mine when I was 24 . that ’ s a little young . I ’ d suggest you wait until you are in your late twenties . , or even in your early thirties if you have a good career . "
neutral, Sure . 
anger,The outrageous conduct of a relative towards me and those close to me.(blaming us and lying)
neutral," I also feel that work efficiency here is very high . and you have strong working ability and professional skill , it seems that you know all , that's really wonderful ! "
neutral,How are you ? 
joy,"I was \best man\"" at my brother's wedding a year ago."""
fear,When I almost fell down from some rocks because I had been acting foolishly and playing dangerously.
joy,Minton 's sober and workmanlike drawings instance his delight in registering rhythmic activity and industrial shapes . 
joy, How about a party at home ? That way we can get together and celebrate it . 
neutral, Yes . 
sadness,When another person's mother died.
anger,"I live by myself and a few weeks ago was woke by a man on the end of my bed coming up my bed at me. I was really angry, told him to get out. He was surprised, hesitated; I started to move towards him and he backed off - kept telling him - loudly, but firmly to go. Because I'd got the initiative, I succeeded. A very powerful message."
fear,Got ill.
neutral," Yes , I do . "
neutral, OK . 
sadness,Death of a pet rabbit. We had to give it away because my brother became allergic to it. We gave it to a man who kept animals and lots of other animals for children to watch. We went to visit our rabbit. It was badly beaten by the other rabbits and eventually died.
joy, Of course . But I'm afraid I'm not much of a dancer ... 
sadness,I did not like it when a little girl was crying for her dead mother and was calling her by her name.  I was sad.
joy,"As the programme of meetings rolled on , sometimes with many presentations on the same day , Horsley was exhilarated , amazed and excited . "
neutral, Yes ? 
sadness," I'm sorry , I didn't know that . But I wanna help . "
neutral, Or getting stuck in traffic jams when you ’ re driving . 
neutral, Me ! Me ! 
joy,"Receiving a very personal letter from a lady that I like, which revealed that she was more enthusiastic about me than I had thought possible."
joy,Some time ago a close relative of mine got off cheap with the worst.
fear,"Once I was very frightened at night as I had a very fearful and terrifying dream, I could not go back to sleep for a long time."
neutral," Yes , sir . "
anger,"When a colleague asked me for help at work, despite the fact that he had more time to do it than I had."
joy,"After I had had a disappointment in my private life, my friend, who studies in Vienna, came to see me spontaneously."
fear," But , dad , it's stormy outside . "
neutral, Snipers ? 
fear," Oh , that scared me . "
sadness,"When a close friend took leave of me, because she went to Israel for one year."
fear,"Our tutorial group was soon to be divided, and we got a list of names of freshmen, out of which five were to be in my group.  We read the names and then each group went its own way to a seminar room.  I wondered how I would cope with the new situation and if I would succeed as a group leader."
sadness,"The fact that my mother is getting married again (my mother and father divorced about 15 years ago) means that she will probably move to Turku, and our home, which is a one family house, will be sold (I myself have not been living at home for the past six years)."
neutral, It's not just that . She also criticizes how we raise the kids . 
fear,"Walking around the University at night by myself, having been previously warned of rapes, etc."
anger,The infuriated Milan Cardinal told the city governor that both the Chief of Police and the governor would be excommunicated if Landriani was not immediately released back to the convent . 
fear,"I stayed alone in the dark at night in the mountain, waiting for my uncle.  I remember that I took a big stone and it calmed me."
joy,We are very happy that the Volkswagen Tour has enabled us to welcome this renowned orchestra to the Festival for the first time . 
joy, Always . 
neutral, Right . 
sadness,When I was in lower six class during the Summer I joined a research group of the Chinese university student union.  I knew a lot of CV students there.  A year later one of them was travelling in mainland China and he got T.B.  He died a few weeks after coming back to H.K.  We all got together for the funeral and when I looked at the body for the last time I felt extremely sad.
sadness," Yes , maybe . But I like street shopping . There is more variety . I'm sorry . I just don't like malls . "
neutral, Mrs . Thou ? 
fear,I had gone for a medical check-up at the U.T.H and failed to make it back on time for the C119 practical sessions at 1400 hours last academic year.
neutral, How often ? 
fear,"Rose was excessively clinging in her behaviour and anxious when Clive was either late , as he often was , or away on an extended business trip . "
anger,"When my father made my mother go through really terrible situations, I felt furious, impotent, nervous, upset, ........"
neutral, I see . 
anger,"Uncleaniness at my work place.  The place is generally not very clean, but when it reaches a point, I get angry at the person who is supposed to clean the place and the people who are supposed to supervise him."
fear,I was on this amusement park ride at Marriots Great America. It went way up in the air and then around and around. Heights are not my favorite spots in life.
anger, How dare you question my statement ! 
anger," Well , he made quite a few mistakes on the monthly report and when his supervisor found them , my manager blamed them on me ! "
joy,When I found out that I had passed the last two exams by a margin of three marks.
sadness, No can do ... sorry . 
fear,"At the dentist's, waiting for my turn to come."
neutral, Really . 
neutral,"What do you do in your free time , Nancy ? "
fear,"wat du i fink about success? It sucks, its much stress...i guess i blew up quick....success.....JAY Z"
anger," I wanted to , but I knew that if I spoke to her , I'd just blow up at her , so I decided to just go home . I called her later that the night , but she didn't answer the phone . "
anger,Jean-Paul gave a sigh of exasperation . 
anger," No , you haven ’ t . You just don ’ t care about me . You ’ re an indifferent husband . "
joy,When my friend told me that he would come and meet me in a moment.
sadness,Death of my grandmother.
joy, Check out your mom's closet . I'll bet she still has something . 
neutral," If I were Li Na , I would ask her if she had done that . "
neutral, Haven't you heard that he is in prison ? 
joy,When I realized that I loved someone of the opposite sex.
neutral," At the beginning , it does not matter , but once someone gets one ball in , it is set . "
anger,"This time , with deepening anger on the streets over price liberalisation , the hardliners were not to forgo their chance . "
joy,"When I got a stereo walkman from my father when he had finacial difficulties. I thought that although he promised to give me that present, he was not obliged to do so."
sadness,When my grandmother died of cancer.
fear,"When I was 20 years old, I fell severely ill and was bed-ridden for 6 months.  I felt very scared for my health and my studies."
sadness,When we were on holidays my girl-friend had to leave me after 4 weeks and I had to stay in Turkey for some more weeks because I had a job there.
fear,"Walking back from the gas station me, @Brooklyns_MoKo, and Faisal saw a dog without a leash and freaked the hell out "
anger,How dare you accuse me of stealing your computer ? 
joy,What a great weekend that was ! 
anger,"Without my permission, my son had made popcorn after coming back from school.  The consequences were a spoilt kettle and chaos in the kitchen but what could have happened with the hot grease ?"
sadness,"As he was rushed to hospital , his devastated daughter Suzanne went ahead with the service -- not knowing if he would live or die . "
joy," Pretty good , thanks . I'm going to see my uncle . "
anger,I was very angry at my father when he didn't give me as much money as my brother to use for studying. Once again my brother was better off then me.
anger,"It was quite recently, at the football match between the national teams of Bulgaria and France. I felt strong anger with the Scottish referee who ran the match quite partially."
joy,"When I achieved my first 6 at University after a long string of 3's, 4's and 5's (7 is the highest mark awarded, 3 is a conceded pass)."
anger,"The Direktor felt , not for the first time , deeply resentful of the fact that they had any part in choosing the programme . "
fear,"For all those years you've protected the seed, it's time to become the beautiful flower.~S.C. Paul   "
neutral, I'm very sorry I can't . 
fear,I was bitten by a dog.
fear,"Twitter, you'll never see me run as fast again as I am from @BibiLynch right now. "
anger,When the university withdrew the accomodation that it had given me.
anger,It was necessary to organise a competition in connection with a celebration. Everyone was to be present at that event. It turned out that there was no audience at all because everyone had pretended to be very intelligent and no one had come. I got furious.
joy,"The final marks were to be given in the morning.  I wanted to get there late because I was very afraid.  When I arrived there, everybody was very happy and I had also passed.  We had a wonderful time all day long."
anger, That's not nice . 
anger, It costs more than you think to run a car---especially when there are so many things wrong with it ! 
joy,"Hi , Monica , congratulations ! Your presentation at the meeting was very successful and everyone was impressed by your speech . And it was so persuasive and I bet our clients will be convinced to invest their money in this project . You really made a big contribution to our company . "
joy,"I remember my religious experience.  During  a gospel camp, a few friends of mine decided to believe in God.  The joy that I felt at that time was more than words can express.  I blessed them and praised God in my heart."
neutral,"Hey , Mary , what's up ? "
joy,Getting into this university to do medicine.
neutral,Here's the restaurant we're meeting the Smiths at . 
joy,"A surge of elation rushed through his body as he read the note for the third time , unable to believe the implications of what he was reading . "
fear,"When I asked if they could make me an identical one trimmed with black fur and beading instead , they were horrified but they agreed in the end . "" "
anger, I've been with this firm for 26 years and I'd hate to see it go down the drain due to poor leadership skills . 
anger,"` No , better to limit the damage , control his anger , make nothing of it , pretend he didn't mind . "
sadness,To fight with a sister and to know that she doesn't care.
joy,"I was joyful when I received a present (2 books and a pencil) from the headmaster in standard 6 because I had passed, I became No 1 and he said I was one of the pupils who had good behaviour."
anger," Yes , but you might have told me before . "
